#***************************************************************************

#sjplacer

#Version:            1.1

#Build Date:         Dec  5 2017 15:35:27

#File Generated:     Feb 21 2020 17:19:58

#Purpose:            

#Copyright (C) 2010-2011 by Softjin Technologies Pvt Ltd. All rights reserved.

#***************************************************************************

Executing : C:\Program Files (x86)\Cypress\PSoC Creator\4.2\PSoC Creator\bin/sjplacer.exe --proj-name 3HC_Firmware_0_1 --netlist-vh2 3HC_Firmware_0_1_p.vh2 --arch p35_udb4x6 --arch-file C:\Program Files (x86)\Cypress\PSoC Creator\4.2\PSoC Creator\dev\arch/udbdsi_4x6_24.cydata --ip-file C:\Program Files (x86)\Cypress\PSoC Creator\4.2\PSoC Creator\dev\psoc5/psoc5lp/ip_blocks.cydata --rrg-file C:\Program Files (x86)\Cypress\PSoC Creator\4.2\PSoC Creator\dev\psoc5/psoc5lp/route_arch-rrg.cydata --irq-file C:\Program Files (x86)\Cypress\PSoC Creator\4.2\PSoC Creator\dev\psoc5/psoc5lp/irqconn.cydata --drq-file C:\Program Files (x86)\Cypress\PSoC Creator\4.2\PSoC Creator\dev\psoc5/psoc5lp/dmaconn.cydata --dsi-conn-file C:\Program Files (x86)\Cypress\PSoC Creator\4.2\PSoC Creator\dev\psoc5/psoc5lp/dsiconn.cydata --pins-file pins_68-QFN.xml --lib-file 3HC_Firmware_0_1_p.lib --sdc-file 3HC_Firmware_0_1.sdc --io-pcf 3HC_Firmware_0_1.pci --outdir .

		Softjin Techologies Placer, Version 1.1

Build Date : Dec  5 2017	15:33:41

D2004: Option and Settings Summary
=============================================================
Netlist vh2 file          - 3HC_Firmware_0_1_p.vh2
Architecture file         - C:\Program Files (x86)\Cypress\PSoC Creator\4.2\PSoC Creator\dev\arch/udbdsi_4x6_24.cydata
Package                   - 
Defparam file             - 
SDC file                  - 3HC_Firmware_0_1.sdc
Output directory          - .
Timing library            - 3HC_Firmware_0_1_p.lib
IO Placement file         - 3HC_Firmware_0_1.pci

D2050: Starting reading inputs for placer
=============================================================
D2065: Reading netlist file : "3HC_Firmware_0_1_p.vh2"
D2065: Reading arch file : "C:\Program Files (x86)\Cypress\PSoC Creator\4.2\PSoC Creator\dev\arch/udbdsi_4x6_24.cydata"
D2051: Reading of inputs for placer completed successfully

D2053: Starting placement of the design
=============================================================

Phase 2
Phase 3

Design Statistics after Packing
    Number of Combinational MCs 	:	14
    Number of Sequential MCs    	:	31
    Number of DPs               	:	8
    Number of Controls          	:	6
    Number of Status            	:	5
    Number of SyncCells         	:	0
    Number of count7cells       	:	0

Device Utilization Summary after Packing
    Macrocells                  :	45/192
    UDBS                        :	11/24
    IOs                         :	21/72


D2088: Phase 3, elapsed time : 0.0 (sec)

Phase 4
D2088: Phase 4, elapsed time : 0.0 (sec)

Phase 5
D2088: Phase 5, elapsed time : 0.0 (sec)

Phase 6

######################################################################
Placement Timing Summary

The timing summary is based on estimated routing delays after
placement. For final timing report, please carry out the timing
analysis after routing.
======================================================================

######################################################################
                     Clock Summary 
======================================================================
Number of clocks: 13
Clock: ADC_Ext_CP_Clk       | Frequency: N/A       | Target:  24.0 MHz
Clock: ADC_Ext_CP_Clk(routed) | Frequency: N/A       | Target:  24.0 MHz
Clock: ADC_theACLK          | Frequency: N/A       | Target:   0.1 MHz
Clock: ADC_theACLK(fixed-function) | Frequency: N/A       | Target:   0.1 MHz
Clock: CyBUS_CLK            | Frequency:  40.7 MHz | Target:  24.0 MHz
Clock: CyBUS_CLK(fixed-function) | Frequency: N/A       | Target:  24.0 MHz
Clock: CyILO                | Frequency: N/A       | Target:   0.1 MHz
Clock: CyIMO                | Frequency: N/A       | Target:  24.0 MHz
Clock: CyMASTER_CLK         | Frequency: N/A       | Target:  24.0 MHz
Clock: CyPLL_OUT            | Frequency: N/A       | Target:  24.0 MHz
Clock: \ADC:DSM\/dec_clock  | Frequency: N/A       | Target:   0.1 MHz
Clock: timer_clock          | Frequency: N/A       | Target:   0.0 MHz
Clock: timer_clock(fixed-function) | Frequency: N/A       | Target:   0.0 MHz

======================================================================
                     End of Clock Summary
######################################################################

D2088: Phase 6, elapsed time : 0.0 (sec)

Phase 7
######################################################################
                     Clock Summary 
======================================================================
Number of clocks: 13
Clock: ADC_Ext_CP_Clk       | Frequency: N/A       | Target:  24.0 MHz
Clock: ADC_Ext_CP_Clk(routed) | Frequency: N/A       | Target:  24.0 MHz
Clock: ADC_theACLK          | Frequency: N/A       | Target:   0.1 MHz
Clock: ADC_theACLK(fixed-function) | Frequency: N/A       | Target:   0.1 MHz
Clock: CyBUS_CLK            | Frequency:  42.6 MHz | Target:  24.0 MHz
Clock: CyBUS_CLK(fixed-function) | Frequency: N/A       | Target:  24.0 MHz
Clock: CyILO                | Frequency: N/A       | Target:   0.1 MHz
Clock: CyIMO                | Frequency: N/A       | Target:  24.0 MHz
Clock: CyMASTER_CLK         | Frequency: N/A       | Target:  24.0 MHz
Clock: CyPLL_OUT            | Frequency: N/A       | Target:  24.0 MHz
Clock: \ADC:DSM\/dec_clock  | Frequency: N/A       | Target:   0.1 MHz
Clock: timer_clock          | Frequency: N/A       | Target:   0.0 MHz
Clock: timer_clock(fixed-function) | Frequency: N/A       | Target:   0.0 MHz

======================================================================
                     End of Clock Summary
######################################################################
D2088: Phase 7, elapsed time : 0.5 (sec)

Final Design Statistics
    Number of Combinational MCs 	:	14
    Number of Sequential MCs    	:	31
    Number of DPs               	:	8
    Number of Controls          	:	6
    Number of Status            	:	5
    Number of SyncCells         	:	0
    Number of count7cells       	:	0
    Number of IOs       	:	21

Device Utilization Summary
    Macrocells                  :	45/192
    IOs                         :	21/72



######################################################################
Placement Timing Summary

The timing summary is based on estimated routing delays after
placement. For final timing report, please carry out the timing
analysis after routing.
======================================================================


######################################################################
                     Clock Summary 
======================================================================
Number of clocks: 13
Clock: ADC_Ext_CP_Clk       | Frequency: N/A       | Target:  24.0 MHz
Clock: ADC_Ext_CP_Clk(routed) | Frequency: N/A       | Target:  24.0 MHz
Clock: ADC_theACLK          | Frequency: N/A       | Target:   0.1 MHz
Clock: ADC_theACLK(fixed-function) | Frequency: N/A       | Target:   0.1 MHz
Clock: CyBUS_CLK            | Frequency:  43.7 MHz | Target:  26.3 MHz
Clock: CyBUS_CLK(fixed-function) | Frequency: N/A       | Target:  24.0 MHz
Clock: CyILO                | Frequency: N/A       | Target:   0.1 MHz
Clock: CyIMO                | Frequency: N/A       | Target:  24.0 MHz
Clock: CyMASTER_CLK         | Frequency: N/A       | Target:  24.0 MHz
Clock: CyPLL_OUT            | Frequency: N/A       | Target:  24.0 MHz
Clock: \ADC:DSM\/dec_clock  | Frequency: N/A       | Target:   0.1 MHz
Clock: timer_clock          | Frequency: N/A       | Target:   0.0 MHz
Clock: timer_clock(fixed-function) | Frequency: N/A       | Target:   0.0 MHz

======================================================================
                     End of Clock Summary
######################################################################

Phase 8
D2088: Phase 8, elapsed time : 0.0 (sec)

D2054: Placement of the design completed successfully

I2076: Total run-time: 1.3 sec.

